start	end	text
1597220	1601740	Angela. What is the latest that you can tell us about this devastating event?
1602940	1612180	Good morning. The news I'm receiving from Afghanistan is actually I can say
1612180	1623860	that is a very very very big the the the darkest time that we are experiencing in
1623860	1632300	Afghanistan. The number that the Taliban are trying to share with the media is very different
1632300	1640940	what we we have receiving from the people. I think in that area we have we had
1641540	1652300	more than 20 violence which are completely destroyed in the earthquake and also
1652740	1659180	there is no way for the actually in the first half where Taliban tried to control the medias
1659180	1667060	we didn't receive there actually we thought that everything is not that that bad what
1667580	1675900	what we we when when we we sent the volunteers group to to the area and and
1675900	1683360	actually I'm so sorry I'm no don't worry and so Angela basically the the the Taliban have gone
1683360	1688400	back to what they said the numbers have changed but what are people saying on the ground those
1688400	1697800	who've been affected they don't accept the numbers which the Taliban is sharing actually
1698140	1705980	and also I think more than 2 000 people are killed a thousand people displaced
1706620	1716360	and and thousand people are missed in missing in this crisis and we we have nothing at that
1716360	1725260	moment at this moment there are no no big big affair or support from from the Taliban for the
1725260	1735020	people just that just the Red Cross and MSF provided some help for the people and and
1735020	1740440	the volunteers group from Angela and other cities thank you so much for coming on to the program
1740440	1745880	telling us about the devastating earthquake that has shaken Afghanistan in the west of the country
1745880	1750020	this is Newsday on the BBC World Service with Rob and Vic to stay with us if you can
1753190	1758630	distribution of the BBC World Service in the US is made possible by American Public Media
1758630	1765310	producer and distributor of award-winning public radio content APM American Public Media with
1765310	1771870	support from Drexel University whose model of experiential education infuses academics with
1771870	1777450	real experience yielding impactful results find out more at drexel.edu
