start	end	text
1576240	1582880	channel Instagram. Presumably you've called your aunt's phone. Does it ring? Does anybody answer?
1584660	1594520	Actually, at the beginning, when some people try to text her, the Hamas answered the phone and wrote
1594520	1602000	in English. But other than that, when we try to call now, there is no line. You don't reach
1602000	1606980	to anything. It's ringing, but nobody answered. Have you spoken to the police? Have you spoken
1606980	1613880	to people in the army? We try. Even during the library, we call the authorities and they all say
1613880	1620460	they are aware of the problem and they really don't have something to do right now. It is a chaos.
1620800	1626600	It is really a chaos. It was a chaos. It's still a chaos. People don't know how to manage.
1627280	1631880	It was really a surprise attack. People don't know how to manage the situation.
1632480	1636880	What do you and the rest of the family want the authorities to do when it comes to your
1636880	1643640	aunt's partner and his children? We want to bring them home safe, no matter what the price is.
1644080	1652040	I think we all, the toll they took from us, we have 700 people killed,
1652460	1663560	thousands of people injured, not several injured, wounded very hard. It's not supposed to be in
1663560	1667640	civilians' people. Civilians shouldn't be paying this price.
1668000	1672700	Your family is clearly going through a very worrying, harrowing time at the moment.
1673080	1679460	What is it like being an Israeli right now? It's a bit disappointing. It's a bit hard.
1679940	1687040	It's unknown. You don't know what's going to be tomorrow. Is there a big attack also from
1687040	1694260	Hezbollah? Things are going to cool down. Somebody is going to take care of all the people who
1694260	1701620	got injured, who is not home, who is dead. There is so many questions you need to be asked and
1702880	1709320	I don't know. You feel a lot of things right now in Israel, but we all feel very divided.
1710280	1717640	That was Yadin who didn't want us to use her surname talking about her aunt and her partner
1717640	1722460	and their children, including eight-year-old Ella, who they watched being
1723080	1729880	abducted by Hamas fighters on a Facebook Live video on Saturday. We did put her point that
1729880	1734160	the authorities had done very little in her view. To the Israeli military spokesperson we had on
1734160	1740740	the program and she said that they would work to try to recover all of the people who had been taken.
1741940	1747220	That is it for this edition of Newsday. More on that continuing situation in the Middle East
1747220	1750760	on the BBC website at bbcnews.com. Thank you for listening. Thank you.
1760120	1765880	This is KJZZ FM Phoenix and HD, a service of the Maricopa Community Colleges.
1766220	1772240	You can get accurate news and informed analysis every day from KJZZ. You get diverse viewpoints
1772240	1777540	from the region and the world, and it's the news and information you rely on. We're online at
